{"benchmark_task_id": "paper_quality_ipw_hajek_concrete_chain_seed", "chain_id": "ipw_hajek_concrete_estimator_chain", "claims_verified": ["IPW identification conclusion is available on the concrete route.", "The constant Hajek estimator equals the target for every sample size.", "The centered numerator residual is zero for every sample size.", "The scaled linearization identity holds for every sample size."], "component_count": 4, "component_passed": 4, "expected_premises": ["StatInference.paperQualityIPWHajekConcreteEstimatorChain"], "module": "StatInference.Examples.ConcreteEstimatorChain", "no_placeholder_policy": true, "notes": "P8.M2 concrete estimator chain: a single no-sorry Lean theorem composes the IPW/Hajek route through identification, exact target recovery, residual control, and scaled linearization.", "passed": true, "proof_components": [{"expected_premises": ["StatInference.VerifiedIPWIdentification.identifies"], "status": "passed", "task_id": "ipw_identification_certificate_seed", "verification_status": "accepted"}, {"expected_premises": ["StatInference.IPWHajekLinearizationRoute.scaledLinearization"], "status": "passed", "task_id": "ipw_hajek_scaled_linearization_route_seed", "verification_status": "accepted"}, {"expected_premises": ["StatInference.constantIPWHajekLinearizationRoute"], "status": "passed", "task_id": "constant_ipw_hajek_route_seed", "verification_status": "accepted"}, {"expected_premises": ["StatInference.constantIPWHajekSequence_estimate_eq_target"], "status": "passed", "task_id": "constant_ipw_hajek_exact_target_seed", "verification_status": "accepted"}], "report_id": "concrete-estimator-chain::ipw_hajek", "route_declarations": ["StatInference.paperQualityIPWHajekRate", "StatInference.paperQualityIPWHajekRoute", "StatInference.paperQualityIPWHajekConcreteEstimatorChain"], "source_file": "StatInference/Examples/ConcreteEstimatorChain.lean", "theorem": "StatInference.paperQualityIPWHajekConcreteEstimatorChain", "verification_status": "accepted"}
